description,business_tags,sector,category,niche,insurance_label,insurance_label_scores,pred_status,top1_score,gap_top1_top2,human_ok,notes
"Vermont Directional Boring is an underground construction company that specializes in horizontal directional drilling, auger boring, and tunneling methods to install utility pipes for various industries such as electric, telecommunications, oil and gas, sewer, water, and irrigation. They offer services such as underground auger drilling, pilot tube guided boring, microtunneling, tunneling, pipe ramming, pipe jacking, concrete box jacking (jack & bore), rock drilling, and sliplining. Their mission is to provide safe, timely, and high-quality underground utility installation to their customers at a competitive price. They have decades of experience and attention to project detail, making them a reliable choice for directional drilling and boring projects. Directional drilling is environmentally friendly and reduces rehabilitation time, and Vermont Directional Drilling is a member of Naics.","['Underground Construction Services', 'Pipe Ramming Services', 'Rock Drilling', 'Directional Drilling Services', 'Pipe Jacking Services', 'Sliplining Services', 'Concrete Box Jacking Equipment', 'Tunneling Services']",Services,Construction Services,Water and Sewer Line and Related Structures Construction,Directional Drilling Services,0.5307,confident,0.5306799113665019,0.3704158963484665,,
"BetonBestellen.nl is a company based in Tholen, Netherlands, specializing in the supply of concrete products and ready-mix concrete. The company operates as a concrete contractor and product supplier.","['Online Concrete Ordering', 'Fast Delivery Service', 'Concrete Products', 'Conveyancing Services', 'Same-day Concrete Delivery', 'Ready-mix Concrete Production', 'Convenient and Efficient Concrete Pouring Solutions', 'Concrete Contractors', 'Concrete Pump Rental Services']",Services,Concrete Work,Poured Concrete Foundation and Structure Contractors,Tilt-Up Concrete Services; Precast Concrete Installation,0.2931; 0.2618,confident,0.2930909490422237,0.0313094898866289,,
"Q2 Engineering Sdn. Bhd. is a company based in Petaling Jaya, Selangor, Malaysia. It operates in various sectors including waste management, biotechnology, environmental consulting, and renewable natural resources. The company also provides services related to power stations, sewage treatment plants, and solid waste engineering.","['Biogas/landfill Gas', 'Operation And Maintenance', 'Construction Services', 'Installation Services', 'Gas Extraction Optimization', 'Renewable Energy Projects', 'Hazardous Waste Disposal', 'Gas Production Forecasting', 'Engineering Services', 'Power Station', 'Support and Engineering Assistance', 'Methane Testing', 'Project Management Services', 'Consultancy & Feasibility Studies', 'Biotechnology', 'Procurement Services', 'Sewage Treatment Plant', 'Feasibility Calculations', 'General Contractor', 'Waste Management Facility', 'Renewable Resources', 'Pumping Tests', 'Commissioning Services', 'Solid Waste Engineering', 'Environmental Consulting Services', 'Carbon Reduction Investments', 'Maintenance Services']",Services,Garbage Collection & Waste Disposal,Solid Waste Combustors and Incinerators,Waste Management Services,0.2897,confident,0.2897202783017142,0.1432738768857743,,
"The company offers convenient and reliable cleaning services for businesses, including stores, condominiums, and shopping centers. They provide high-quality cleaning services that meet the standards desired by their clients.","['Cleaning Services for Condominiums', 'Shopping Center Cleaning', 'Standard Cleans']",Services,Office & Industrial Cleaning,Janitorial Services,Building Cleaning Services,0.2845,confident,0.2845365036974426,0.0852593519153957,,
CS-Cart is a software company that provides secure and full-featured online shopping cart software with a complete set of powerful ecommerce options. Their software allows users to create their own online store with minimum effort.,"['Copper Pcb', 'XRF Equipment', 'Paints and Powders', 'CMI 500 Series', 'Software Development and Implementation of Software', 'Software Solutions Provider']",Manufacturing,Laboratory Equipment & Supplies,Analytical Laboratory Instrument Manufacturing,Software Development Services; Software Manufacturing,0.2743; 0.2473,confident,0.2743033914669407,0.0269954088904759,,
Dr. Ruby is a company that specializes in soil science and the relationship between plants and soil. The company's main focus is on the negative impact that plants can have on individuals and businesses.,"['Content Creation', 'Plant-related Content Creation', 'Plant and Soil Technology Education', 'Blogging Platform', 'Plant-related Products and Services']",Manufacturing,Plant Nurseries & Stores,Nursery and Tree Production,Ornamental Plant Nurseries; Content Creation Services,0.2600; 0.2258,confident,0.2599930637812066,0.0342412968004036,,
"Pavimento Impreso Impredo Catalunya is a construction company with over 15 years of experience in the industry. They specialize in the production of stamped concrete, polished concrete, walls, retaining walls, and facade decoration. The company has a team of professionals who are trained and specialized in meeting the demands of their clients for stamped concrete and concrete. They offer maintenance and improvement services for concrete and stamped concrete. Additionally, they are experts in the construction of walls and facades.","['Construction Services', 'Facade Decoration Services', 'Containment Walls', 'Maintenance and Improvement Work', 'Vertical Cladding', 'Reinforced Concrete']",Services,Concrete Work,Poured Concrete Foundation and Structure Contractors,Tilt-Up Concrete Services,0.2376,confident,0.237589942124442,0.0626161729510533,,
"Prefer Pets Travel Gear is a company that specializes in designing and manufacturing small pet carriers for pet owners who travel with their pets. The company was founded in 2006 by a husband and wife team who were inspired to create a better carrier for traveling with their two pets after their son's accidental escape from a pet box store. The carriers are designed with features and functions that they wished they had on their own travels with Button and ShoSho, and are constantly evolving based on feedback from real customers and their own experiences. Prefer Pets offers convenient, safe, and secure carriers for transportation by foot, car, plane, and train. The products are created with mindful designs, quality material and construction, and real old-fashioned customer service. The carrier collection includes the 368 Adventure Backpack, Hideaway Backpack™,358 Hideaway™ Backpack XXL, Original Pet Backpack XL, and Hideaway Duffel, among others.","['Padded Shoulder Straps', 'Jet Carrier', 'Dog Totes and Accessories', 'Hideaway XL Twin Duffel', '360° Tangle-free Retractable Dog Leash', 'Travel Gear', 'Pet Carriers', 'Base Pads', 'XL Pet Carrier Backpack']",Manufacturing,Pet Shops,Other Animal Food Manufacturing,Pet Food Manufacturing,0.2352,confident,0.2351639607744442,0.08827724955989,,
"TD Smirnov is a Russian company that specializes in providing color solutions for the packaging industry. They offer a comprehensive supply of dyes, superconcentrates, masterbatches, and additives for polymers, alcoholic and water-based flexo inks, including flexographic ink, masterbatch, UV-ink, cardboard printing inks and inks. They also provide polymer modifiers, deep printing paints, and alcoholic and waterproof flexoprintings. The company has its own production of flexographic paints from FORZA components and offers a complete supply of superconcencerates, flexographic paint, and customized raw materials. They are a universal supplier of leading Russian producers of super-concentrate and modifiers and have an automatic mixing station ink maker for 14 pumps.","['Alcohol-soluble Flexo Ink', 'Customized Raw Materials for Flexographic Paints', 'Dyes and Modifiers for Polymers', 'Deep Printing Paints', 'Cardboard Inks Manufacturer', 'UV Inks']",Manufacturing,Chemicals,"Photographic Film, Paper, Plate, Chemical, and Copy Toner Manufacturing",Ink Production Services,0.2205,confident,0.2204675930235858,0.1314838241136914,,
"Homes and Loans with Michelle is a real estate and loan company that offers a range of services to make the process of buying or selling a home easy and hassle-free. They provide assistance with finding a home loan, finding a new home, and down payment assistance through one of the Texas First Time Home Buyer programs. The company offers a one-stop-shop for residential and rental properties of all sizes, from condos to mansions, and can help with affordability, credit, legal matters, and income. They also provide a current list of available properties for clients to browse.","['New Home Assistance', 'Property Search Assistance', 'Follow-up Support', 'Real Estate Loan Services', 'Real Estate Brokerage Services', 'Home Loan Assistance', 'Down Payment Assistance', 'Residential Rental', 'Closing on Dream Homes', 'Texas First-time Home Buyer Programs', 'Savings and Credit Simulation']",Services,Mortgage Brokers,Real Estate Credit,Real Estate Services,0.2118,confident,0.211794494397609,0.1262293577144311,,
"Sin Kong Fatt Trading Sdn Bhd is a company based in Bau, Sarawak, Malaysia. It operates as a stationery store.",[],Retail,Office Supplies,Office Supplies and Stationery Retailers,Stationery Manufacturing,0.2106,confident,0.2106252285518902,0.1967341614779446,,
"Hunter Decoy, also known as hunterdecoy, is a company that specializes in creating a decoy designed to enhance the hunting experience for hunters. The company spent over two years perfecting the decoy to ensure it is a must-have for serious hunters.","['Pop up Blind Decoys Producer', 'Tree Stand Decoys', 'Bear Hunting Decoys', 'Hunting Equipment Manufacturing', 'Big Game Decoys']",Manufacturing,Fish Farms,Hunting and Trapping,Fishing and Hunting Services,0.1904,confident,0.1903993415619609,0.1527058482311692,,
"Southern Star Central Gas Pipeline Inc. is a natural gas transportation company that operates approximately 5,800 miles of natural gas transmission pipeline in the Midwest and Mid-Continent regions of the United States. The company was formed in 2003 and has since become a leading provider of clean, safe, and reliable energy to the communities it serves. Southern Star is committed to sustainability and works towards this goal through responsible environmental, social, and governance practices. The pipeline company has a rich history dating back to the turn of the twentieth century when explorers discovered natural gas with oil and began transporting it across the country. Today, Southern Star continues to meet the growing demand for sustainable energy and is positioned to meet future energy needs.","['Interstate Gas Transmission', 'Gas System Modernization', 'Natural Gas Transportation', 'Pipeline Integrity Services', 'Energy Infrastructure', 'Pipeline Facility Management', 'Energy Transmission Services', 'Natural Gas Storage', 'Gas Pipeline Operations', 'Gas Compression Services', 'Regulated Gas Utility']",Wholesale,Oil & Gas - Extraction & Distribution,Pipeline Transportation of Natural Gas,Gas Manufacturing Services; Pipeline Construction Services,0.1889; 0.1670,confident,0.1889460303694748,0.0219729132062084,,
"Thermo-Dyne is a manufacturers representative company based in Minneapolis, Minnesota that specializes in providing innovative and cost-efficient solutions for complex HVAC projects. With over 45 years of experience, they offer a wide range of engineered products for commercial, institutional, and industrial heating, ventilating, and air conditioning (Hvac) markets. Their team of highly-trained employees and owners have over 100 years of combined experience in the application, installation, and service of mechanical systems, dedicated to creating comfortable indoor air environments year-round. Thermo-dyne offers customized HVAG solutions for air conditioning, refrigeration, heating, and ventilation needs. They are committed to providing quality products that are engineered and selected to create optimal indoor air conditions.","['High-end Heating and Air-conditioning Markets', 'Mechanical System Design and Installation Services', 'Customized HVAC Solutions', 'Indoor Air Quality Optimization', 'Manufacturers Representative', 'Commercial Engineering Services']",Manufacturing,Industrial Air Solutions,Air-Conditioning and Warm Air Heating Equipment and Commercial and Industrial Refrigeration Equipment Manufacturing,HVAC Installation and Service,0.1874,confident,0.1874246817779736,0.062262870753616,,
"Culture of Java is a company that focuses on the Indonesian language and culture. They have presented a play called ""Parikesit Jumeneng Ratu"" by Ki Enthus Susmono, which tells the story of Parikesit being made Queen in Asti. The play features a storyline, jokes, and satire integrated into each dialogue between characters.","['Non-profit Organization', 'Cultural Heritage Preservation', 'Cultural Organization', 'Storytelling Performances', 'Non-profit Cultural Organization for Java']",Non Profit,Churches & Religious Organizations,Religious Organizations,Non-Profit Management,0.1787,confident,0.1786569575967611,0.1339470680677988,,
"Intrachem Limited is a Nigerian company that specializes in company registration and business registration services. They offer a range of services related to company formation and registration, including obtaining a company license and registering with relevant authorities.","['Corporate Registry Services', 'Registration Services', 'Legal Services']",Manufacturing,Chemicals,All Other Basic Organic Chemical Manufacturing,Legal Services; Chemical Manufacturing,0.1767; 0.1640,confident,0.1767299822457418,0.0127534779146675,,
"Qonrad Media is a company that specializes in video production and editing services. They offer a range of services including feature and documentary videos, promotional and aftermovies, animation, photo and graphics, and writing and directing. They have worked on various projects such as ""Extraordinary Ordinary People,"" ""2 Wrongs,"" ""Easter Weekend,"" ""Fresh Fridays,"" ""Target Events,"" ""Do not sleep!,"" ""Wreck Race,"" ""Bingo Heist,"" ""Halloween,"" ""Garden Party,"" ""Firing Ground,"" ""Rafting,"" ""Ball,"" ""Techno Rave,"" ""Tion Wayne,"" ""Jacob,"" ""Loving You,"" ""Children's Day,"" ""Steakhouse,"" and ""Mama.""","['Aftermovie and Promotional Video Production', 'Video Production Services', 'Garden Party 2', 'Media Production Services', 'Animation Services', 'Easter Weekender', '2 Wrongs Trailer', 'Editing Showreel 2020', 'Graphic Design Services', 'Fresh Fridays', 'Targeted Events', 'Steakhouses', 'Wreck Racing', 'Mother', 'Halloween Fun', 'Tiktok and Instagram Reels', 'Photography Services', 'Directing And Writing', 'Childrens Day', 'Techno Rave', 'Bingo Heist', 'Feature Documentary Production', 'Loving You']",Services,Video and Audio Production,Motion Picture and Video Distribution,Media Production Services,0.1752,confident,0.1752473485449207,0.0603583973905739,,
"The National Tribal Healthy Homes Assessment, Training & Technical Assistance Support Center is a program of Montana State University Extension, Housing and Environmental Health Program, funded by the U.S. Department of Housing and Urban Development. It is a partnership between the MSU Extension Housing & Environmental Health program and the Native American Housing Technical Assistance Institute, with the aim of increasing family and community wellness among Native American tribes. The center integrates elements of the existing National Center for Healthy Housing and the Usda/Hud Healthy Homes Partnership program to help tribal communities assess homes for common indoor health hazards such as mold and moisture, carbon monoxide, household chemicals, unsafe drinking water, lead, asbestos, pesticides, radon, dust and dust mites, allergens, asthma triggers, and fire and safety hazards and septic systems. The program offers training and technical assistance to all 562 federally-recognized tribes via national, state, and local tribal partners, as well as interested community agencies and health professionals.","['Tribal Curriculum Development', 'Training Opportunities for Tribal Housing Authorities', 'Non-profit Organization', 'Home Assessments', 'Native American Media', 'Occupant and Youth Targeted Educational Material', 'Technical Assistance for Indoor Health Hazards', 'Multi-day Healthy Homes Trainings', 'Housing and Environmental Health Program']",Services,Housing Programs,Other Community Housing Services,Environmental Health Services,0.1628,confident,0.1627972051254179,0.0964864408524662,,
"Asrama Polisi Sendang Mulyo Blok C18 is an apartment building located in Semarang, Central Java, Indonesia.",['Residential Property Development'],Services,Real Estate Rental,Lessors of Residential Buildings and Dwellings,Real Estate Services,0.1602,confident,0.1602178918130071,0.0581979016259563,,
"The Ministry of Agriculture of the Republic of Azerbaijan is the central executive body of the country's agricultural sector. It is responsible for implementing state policies in the production and processing of agricultural products, providing essential services to producers, veterinary, plant protection and quarantine, and efficient use of land. The Ministry coordinates and oversees various Agro Services Agency, Agro Credit and Development Agency, Agricultural Research Center, Agrarian Science and Innovation Center, State Seed Fund, Republican Artificial Insemination Center, and other related organizations. The ministry also oversees the activities of several Agricultural Production and Processing Union LLCs, State Agro Trade Company LLC, Green Park Azerbaijan LLC, and Regional Agricultural Development Centers. The organization was re-arranged in accordance with the Order of the President of the Azerbaijan Republic and has several central executive authorities.","['Agricultural Sector Regulation', 'Agriculture Economic Activity', 'Food Security Enhancement', 'Agricultural Trade Facilitation', 'Farm Productivity Initiatives', 'Rural Development Programs', 'Crop Production Support', 'Agriculture Sustainability Efforts', 'Agricultural Policy Development', 'Livestock Industry Oversight', 'Agricultural Technology Advancement', 'Agricultural Subsidies Management', 'Agricultural Research Promotion', 'Agricultural Education and Training', 'Agriculture-related Legislation']",Government,"Executive, Legislative & Government Institutions",Regulation of Agricultural Marketing and Commodities,Agricultural Equipment Services; Agricultural Machinery Installation,0.1585; 0.1500,confident,0.158528984292883,0.0085326590608742,,
"They offer a variety of products, including vertical rollable aluminum mosquito nets that are designed for all types of windows and balconies. These nets are easy to install and disassemble, using a simple ladder, latches, and screws. The company also offers a range of colors to match the aesthetics of the windows and balcony. The nets are designed to protect homes from mosquitoes and provide a physical barrier against harmful insects.","['Mosquites for Windows and Balconies', 'Fiberglass with Grassy Tones', 'Manufacturing', 'Retail', 'Aluminum Profiles']",Manufacturing,Aluminum Processing & Products,"Other Aluminum Rolling, Drawing, and Extruding",Windows and Doors Installation,0.1475,confident,0.1475284527831533,0.1108231918134338,,
Silverstein is a company that specializes in interdisciplinary design and behavioral research. They focus on applying behavioral science to create optimal human experiences.,"['Research-focused Experience Design Services', 'Design Research', 'Human Understanding']",Education,Educational Consultants,Educational Support Services,Interior Design Services; Graphic Design Services,0.1463; 0.1435,confident,0.1463478500532941,0.0028922143538089,,
"Hydro-ECO is a company that specializes in the production and sale of non-woven wallpaper, a glass fiber-based, non-weaveable wall covering. Their painting nonwoven material is a special material used for the renovation and refurbishment of walls and ceilings. The materials are used to reinforce plastered surfaces such as plaster and concrete, and are suitable for both indoor and outdoor use. The company has expanded its product portfolio to include accessories for sanitary installations, ground source heat pumps, air sources, ventilation systems, recuperators, and climate control units. They have also added manufacturing technologies and materials, as well as spray insulation services. Hydro ECO is the largest supplier of nonwound wallpaper in Poland and has its own machinery that forms rolls with different sizes for packaging. Their products are waterproof, weatherproof, and not flammable.","['Boiler Installation Services', 'Special Glass Fibers for Wall Coverings', 'White Paint Nonwoven on Rolls', 'Air Source', 'Ground Source Heat Pump', 'Manufacturing Technology', 'Spray on Insulation Services', 'Fiber Glass Wallcovering Manufacturer', 'Sanitary Accessories Installation', 'Climate Controlled Units', 'Ventilation Systems', 'Non-woven Wallcoverings']",Manufacturing,"Marble, Granite & Stone Products",Gypsum Product Manufacturing,Insulation Services,0.1411,confident,0.1411269567800256,0.0311056613137061,,
"Reach and Make Millions is a company that specializes in providing business and technology advice to Holistic Coaches and Online Entrepreneurs. They offer guidance on how to build a successful online business by helping clients map out their business action plan, create a website that attracts ideal clients, launch programs and product ideas online, and create a thriving online business. Their business curriculum covers various aspects such as website design and development, branding, copywriting, sales funnel design and optimization, systems and automation, and analytical software implementation. Reach and Make Million.com is a free platform that frequently updates its website, which attracts thousands of weekly viewers.","['Workshop Series', 'Analytic Software Implementation Services', 'Business Curriculum Development', 'Done-for-you System', 'Workloads Worksheet', 'Digital Marketing Agencies', 'Business Action Plans', 'Workload Management Services', 'Branding Services', 'Online Business Coaching', 'Copywriting Services', 'Sales Funnel Optimization', 'Automation Implementation Services', 'Website Development Services', 'Team Member Selection and Qualification', 'CEO Transition', 'Holistic Coaching', 'Product Launch Assistance']",Services,Employment Agencies & HR Consulting,Employment Placement Agencies,Website Development Services; Branding Services,0.1409; 0.1405,confident,0.1409443378862928,0.000414635435559,,
"𝐖�𝐚𝐞𝐭𝐫𝐥𝐸𝐤𝐶"" is a water gun shop that specializes in providing high-quality water guns for water enthusiasts. They offer a selection of water pistols designed to enhance the fun and excitement of water play. The company ensures fast shipping with a delivery time of 5-15 days and offers well-protected packaging for their products.",['Water Guns for Water Toy Enthusiasts'],Manufacturing,Gun shop,Small Arms Ammunition Manufacturing,Water Treatment Services,0.1383,confident,0.1383213191108178,0.0913685613436341,,
"Grupo DOS, Servicios Computacionales is a company that specializes in providing high-level IT and computer services. They offer a range of services to their clients and are known for their expertise in the field.","['Telecommunications Equipment Supplier', 'System Design Services', 'Computer Support Services', 'Computer Systems Security Services', 'Website Development Services', 'ITECH Services', 'Consulting Services', 'Computer and IT Services']",Services,Computer Repair & Service,"Construction, Mining, and Forestry Machinery and Equipment Rental and Leasing",Website Development Services; Consulting Services,0.1373; 0.1298,confident,0.137323217955954,0.0075198668672215,,
The company is a volunteer-based organization that focuses on collecting donations of oxygen and plasma. Their mission is to save lives through their efforts.,"['Volunteer-based Organization', 'Blood Donation Services', 'Plasma Donation Services']",Services,Blood Banks & Donation Centers,Blood and Organ Banks,Volunteer Services,0.1362,confident,0.1361916532740481,0.1259141903758317,,
"Tunahanlılar Geri Dönüşüm is a Turkish company that specializes in recycling packaging waste, minerals, and metals in accordance with regulations without damaging the environment. The company operates within a framework of discipline and principles and has become a leader in the metal industry by being part of both import and export structures in Turkey's economy. They offer services such as recycling, demolition, and separation, as well as production and manufacturing of spare parts for machinery and equipment. Tunahanlílar also provides design and manufacturing services for various products such as barrel furniture, wooden decorations, metal paintings, and printed-ball clock parts. The organization holds two warehouses and provides expertise and brokerage services both inside and outside the city. They are committed to sustainable development and are open to innovations alongside technology.","['Demolition and Dismantling of Structures', 'Foreign Products', 'Wooden Decorations', 'Barrel Furniture', 'Waste Management Services', 'Printed-ball Clock Parts', 'Reccling', 'Mobile-friendly Website Design', 'Manufacturing Services', 'Recycling and Processing of Waste Packaging']",Manufacturing,Scrap Metals,"Secondary Smelting, Refining, and Alloying of Nonferrous Metal (except Copper and Aluminum)",Recycling Services; Waste Management Services,0.1317; 0.1241,confident,0.1317296153025091,0.0076643733729252,,
