description,business_tags,sector,category,niche,insurance_label,insurance_label_scores,pred_status,top1_score,gap_top1_top2,human_ok,notes
"The company is a limited liability partnership that specializes in the production and sale of various products, including metal cable manufacturing, ice box cleaning, beverages, water supply facilities, light fittings, sports equipment, electronic components, metal cable production, chemicals, and hydraulic machinery. They have been approved by the Ministry of Commerce for certain projects and are planning to expand their operations in this field.","['Water Facilities', 'Light Fittings', 'Pressure Vessel', 'Ice Box Cleaning Services', 'Chemical Substances', 'Sheet Metal Parts Manufacturing']",Manufacturing,Cables & Wires,Other Communication and Energy Wire Manufacturing,Sheet Metal Services; Ice Production Services,0.1315; 0.1305,confident,0.1315314279703065,0.0010631417516429,,
"Friends of Ritchie Parkette is a group of citizens who advocate for and celebrate the local parkette community. They organize various events and activities, such as plant a butterfly and wild flower garden, hold egg hunts, and participate in public art projects, including the Ritchie Avenue Art (Noise) Wall Public Consultation. They also organize events like the Halloween Carnival and the Noise Wall Art Mural Project, which is an outdoor art competition aimed at creating a noise wall art mural along the green space at the foot of Ritch Avenue in Toronto.","['Community Engagement', 'Community Consultation', 'Community Advocacy and Celebration', 'Public Mural Creation']",Services,Parks,Nature Parks and Other Similar Institutions,Community Engagement Services,0.1313,confident,0.1312694426603027,0.0764555688070568,,
"Bess and Company is a medical equipment and supplies company located in Sevierville, Tennessee. They offer a range of services including equipment rentals such as knee walkers, walkers and oxygen concentrators, bathroom safety equipment, hospital beds and bedrooms, hospital bed and bedroom accessories, and mobility aids such as lightweight and standard wheelchairs. Additionally, they provide medical aids and supplies including bandages, tape, compression hosiery, electrotherapy, CPAP, oxygen, and nebulizers.","['Standard Wheelchairs', 'Medical Equipment Rental', 'Hospital Bed Accessories', 'Medical Supplies', 'Lightweight Wheelchairs', 'Medical Rollators', 'Medical Bandages', 'Mobility Devices', 'Bathroom Safety Equipment']",,,Home Health Equipment Rental,Fire Safety Equipment Services,0.1283,confident,0.1282869887131666,0.0366895611738219,,
"The Guangdong Provincial Dietetic Food Purchasing Department is a government department in Guangdao Province, China that focuses on the development of small and medium-sized enterprises (SMEs) in the food and beverage industry. The department is responsible for the development and implementation of policies and regulations related to food and drink procurement, including food and beverages. The main goal of the department is to promote and support the growth of small, medium, and large-sized businesses in the industry. They aim to improve the quality of the industry and provide a platform for the growth and development of local businesses. The division is located in the central region of Guangduo Province and is overseen by the Ministry of Enterprise.","['Business Development Services', 'Plastic Recycling Services', 'Small Business Support', 'Regulatory Compliance Resources', 'Business Improvement Initiatives Implementation', 'Business Support Services', 'Target Achievement', 'Corporate Quality Enhancement', 'Corporate Social Responsibility Initiatives', 'Productive Product Structures', 'Corporate Culture Development', 'High-level Competitive Advantage', 'International Market Expansion']",Government,"Executive, Legislative & Government Institutions",Administration of General Economic Programs,Business Development Services,0.1280,confident,0.1280176516873991,0.0419935458726142,,
"Grand-Agro is a company based in Azerbaijan that specializes in the cultivation and production of olive and almond trees. They have the largest orchard in the country and offer a variety of products such as olive oil, table olives, and extra virgin olive oil. The company prides itself on providing abundant fruits from their own orchards and has made the earth a place of great joy. Grand-Agrovro has started the construction of a new olive and oil production complex and has planted over a million trees. The olive grove is located in the middle of their orchids and they have won awards for their extra virgin oil.","['Water Purification Chemical Measurements', 'Agricultural Production', 'Food Production', 'Sunflower Oil Production', 'Oil Extraction', 'Almond Harvesting', 'Extra Virgin Olive Oils', 'Laboratory Services for Petrochemical Industry', 'Fruit and Vegetable Cultivation', 'Chemical Analysis Services for Petroleum Products', 'Petroleum Products Manufacturing']",Manufacturing,Edible oils manufacturing & distribution,Fats and Oils Refining and Blending,Oil and Fat Manufacturing,0.1256,confident,0.1255593597081851,0.0570567437283334,,
"Home Instead Caregivers is a non-medical organization that provides a variety of services to enhance the lives of aging adults in Lebanon and Palmyra, PA. They offer reliable and compassionate care at all levels, including specialty care for those with Parkinson's disease, arthritis, and Alzheimer's. Their commitment to quality in-home care is reflected in their unique CAREGiverSM training program, which they utilize to provide reliable and trustworthy caregivers who perform dozens of common household tasks. Home Instead Careguards SM represent a lifeline for families in the area and are dedicated to providing personalized care, building relationships, and enhancing the lives for senior citizens and their families.","['Non-profit Organization', 'Household Tasks', 'Specialty Care for Parkinsons Disease', 'Non-medical Senior Care Services', 'Transportation Services', 'Specialized Care for Alzheimers and Dementia', 'Dependable and Compassionate Care', 'Food Nutrition and Health Services', 'Personalized Care Services for Seniors']",Services,Home Health Care,Home Health Care Services,Animal Day Care Services,0.1250,confident,0.1250046382368746,0.0622084530173543,,
"Polytes is a company based in Patna, Bihar that specializes in manufacturing plastic water tanks, sintex water tanks and stainless steel water tanks.","['Manufacturing of Stainless Steel Tanks', 'Water Tanks Manufacturer']",Manufacturing,Metal Storage Tanks,Other Metal Container Manufacturing,Plastic Manufacturing,0.1180,confident,0.1179701606501089,0.025135991046153,,
"Borda Mais is a Spanish company that specializes in personalized textile embroidery services. They offer a wide range of embroideries for both individuals and businesses, with a focus on providing high-quality and durable products. With over 30 years of experience in the industry, Borda Maís prides itself on its attention to detail and customer satisfaction. They have a large number of ""multicabezales"" machines to handle large embroidering productions and offer a complete advisory service to ensure the best results for their clients. Borda mais is known for its innovative approach and commitment to providing superior quality finishes for all their customers.","['Embellishment Techniques', 'Personalization Services', 'Logo and Letter Visibility Enhancement', 'High-quality Finishes', 'Textile Printing and Embroidery Services', 'Multibrand Embellishing Machines', 'Durable Embellished Products', 'Quality Materials Selection', 'Personalized Textile Embellishments']",Manufacturing,Fabric-Based Home Goods,Narrow Fabric Mills and Schiffli Machine Embroidery,Textile Manufacturing Services,0.1157,confident,0.1156747966844507,0.0766450326278316,,
Escuela de Manejo Emmanuel 2 is a driver and vehicle licensing agency located in Panama's West region.,"['Legal Services', 'Driver Licensing Services', 'Comprehensive Training Programs', 'Driving Education Services', 'Drivers License Training', 'Driver and Vehicle Licensing Agency']",Services,Car Rental,Lessors of Nonfinancial Intangible Assets (except Copyrighted Works),Legal Services,0.1117,confident,0.111711556626689,0.0489806709139572,,
"Yekaterinburg Aeroclub DOSAF Russia is an aviation and sports club located in Yekaterina, Russia. The club is named after Hero of Soviet Union A.K. Serov and offers training flights in Yak-52 and L-13 ""Blanik"" gliders, as well as demonstration flights of Antonov An-2 gliders. The organization has a rich history of 90 years and is managed by the OJSC ""Ekaterinburger Aviation and Sports Club Dosasaf"". The club hosts events such as the annual ""Parashutist - Airman"" dive with its unchanged leader Gatnatullin Rashid Zinatulovich.","['L-13 Glider', 'Sports Services', 'Aviation Clubs', 'Skydiving Experiences', 'Training Courses for Skydivers', 'Yak-52 Training Flights']",Education,Flight Training,Flight Training,Training Services,0.1089,confident,0.1089385806258196,0.0251259718059275,,
"SciTech Central is a research institute located in Walnut, California, United States.","['Creative Commons License', 'National and International Journals', 'Expertise Enhancement', 'Publishing Research', 'Literature Provision', 'Open Access Publishing', 'Awareness Raising', 'Knowledge Dissemination', 'Open Accessible Science and Medicine', 'Awareness Creation', 'Manuscript Preparation', 'Science, Technology, and Medicine Open-access Content', 'Literature Supply to The Developing World', 'Open Access to Scientific Research', 'Quantum to Research Approach', 'Data Distribution']",Services,Newspapers & Magazines,Periodical Publishers,Publishing Services,0.1064,confident,0.1063706816211396,0.0259871599671333,,
"Delta Refractories, Inc. is a manufacturer and distributor of refractory maintenance materials for the metals and chemical process industries. Established in 1971, the company offers a wide range of proprietary shaped and prepackaged refractories products, including monolithic refractors, composite shapes, corrosion products, precast shapes, IFB's and firebrick, and seals and gaskets. Delta has a knowledgeable technical team that assists customers in designing refractoric and anchoring solutions for various types of high-temperature furnaces. The company also manufactures ceramic fiber modules and precast refractorial shapes for the Forge, Primary Metals, and Chemical/Hydrocarbon Processing Industries. Delta Refractors is committed to providing high-quality products and services to its customers.","['Hardware Manufacturers', 'Gaskets and Seals Manufacturer', 'Prefabricated Shapes', 'Ibr’s & Firebrick', 'Refractory Monolithics Manufacturer', 'Ceramic Fiber Manufacturer', 'Refractory Anchors Manufacturer', 'Distribution Services', 'Composite Shapes Manufacturer', 'Precast Specialty Refractories', 'Refractors for The Chemical Industry', 'Corrosion Protection Products Manufacturer', 'Universal Threaded Studs Manufacturer']",Manufacturing,"Minerals, Earths & Ores",Ground or Treated Mineral and Earth Manufacturing,Precast Concrete Installation,0.1054,confident,0.1053576480629614,0.022287509254616,,
Valiant Artificial Lift Solutions is a global company that specializes in providing technologies and services for oil and gas production.,"['Oilfield System Integration', 'Oilfield Service Provider', 'Oilfield Equipment Maintenance', 'Production Optimization Solutions', 'Energy Sector Services', 'Well Performance Improvement', 'Oilfield Engineering Expertise', 'Well Downtime Reduction', 'Oil Production Engineering', 'Artificial Lift Systems', 'Lift System Reliability', 'Energy Production Support', 'Lift System Installation', 'Production Challenge Solutions']",Manufacturing,Heavy Construction Equipment,Support Activities for Oil and Gas Operations,Oil and Fat Manufacturing,0.1032,confident,0.1031929098185017,0.0248229817954268,,
The company is a business analyst and English translator with experience in the industrial laundry sector. They offer their services to start or complement similar projects.,"['Digital Transformation Services', 'Digital Transformation in Industrial Laundry']",Services,Dry Cleaners,Industrial Launderers,Digital Marketing Services,0.1028,confident,0.1028244538874134,0.0342374081505603,,
"Integrity Aviation System is a company founded in 2011 that provides Flight Support services to foreign and local air operators in Mexico and the Caribbean. Their services include Aircraft Handling, Fuel, Representation, Coordination, Supervision, VIP assistance, Catering, Hotac, and Ground Transportation. They aim to be a leader in the aeronautical industry by constantly innovating and maintaining high-quality standards. The company prides itself on being a strategic business partner for their clients and adding value to their operations. They are a member of the National Business Aviation Association, which they consider an essential business partner. The team at IAS has extensive experience in customer service, management solutions, and flight operations, which allows them to go beyond the expectations of their customers. They deliver outstanding services for commercial and general aviation operators flying to any airport and cover what is necessary in any airport as well as the local emergency services for an expedited and safe transition of the patient during critical operations.","['Catering Services', 'Ground Handling Services', 'VIP Care Services', 'Landing Permit Services', 'Aircraft Maintenance', 'Representation & Supervision', 'Supervision Services', 'International Civil Aviation Services', 'Representation Services', '336411 Aircraft Manufacturing', 'Ground Transportation Booking', 'Ground Transportation Services', 'Jet A1, 100LL Fuel', 'Aircraft Handling Services', 'Personal Assistance Services', 'Fueling Service', 'Flight Support Services', 'Overflight and Landing Permits Services']",Services,Airline Companies,Nonscheduled Chartered Passenger Air Transportation,Catering Services,0.1020,confident,0.1019950874823122,0.0322320317890061,,
"X.E.X GROUP is a Vietnamese company that exclusively distributes TEIN brand high-quality automobile fender products from Japan. With over 10 years of experience, they are the official supplier and distributor of these products in Vietnam. Their team of highly skilled technicians, trained by overseas experts, is dedicated to providing the best quality and reliable products to meet the needs of their customers. X.X Group offers a wide range of fender covers for various car models, including Toyota, Mazda, Honda, Nissan, and Mazda6, among others. They also provide accessories such as seat covers, armrests, and carpeting to enhance the comfort and safety of their clients' vehicles.","['12-month Guaranteed Tire Protection Products', 'Automotive Parts Distribution', 'Authorized Distributor', 'MAZDA CX5 STREET ADVANCE Z', 'Authorised Distributor of Automotive Tires', 'Supply & Distribution']",Manufacturing,Auto Parts Manufacturers,Motor Vehicle Seating and Interior Trim Manufacturing,Trim Manufacturing,0.1007,confident,0.100714177562045,0.0614432239224209,,
"The company is a paint dealer located in Karur, Tamil Nādu, India. It operates as both a paint store and a painting store, specializing in the sale of paintings.","['Asian Paint Distributor', 'Varnishes Manufacturer', 'Wholesale Supplies']",Wholesale,"Paints, Coatings, Dyes & Pigments","Paint, Varnish, and Supplies Merchant Wholesalers",Painting Services,0.1006,confident,0.1005562715081292,0.0330634321357899,,
"Kaseem Ali Telecom is a cell phone accessory store located in Pathanpura, Manglaur, Uttarakhand. The store specializes in selling accessories for cell phones.","['Retail', 'Cell Phone Accessories Store']",Services,Cable & Internet Providers,Wireless Telecommunications Carriers (except Satellite),Accessory Manufacturing,0.0996,uncertain,0.0995707740272215,0.0239558942306756,,
"The ASAAI Karate Club is a martial arts school located in the village of Veladimir in the Russian Federation. They offer karate classes for children and adults, focusing on self-defense and self-discipline through the practice of karate. The club is a member of the Russian Karate Association (Asai) and is affiliated with the Russian Self-Defense Instructors Association (Rsai) and the Russian Martial Arts Federation (Rmaf).","['Personalized Training Sessions', 'Group Classes', 'Self-defense Instruction', 'Sportsmanship Training', 'Sports Instruction', 'Karate Training for Children and Adults']",Services,Martial Arts Gyms,Other Spectator Sports,Arts Services,0.0986,uncertain,0.0986181112290608,0.0417884506184802,,
"The Alliance for Migration, Leadership and Development (Amldl) is an international non-governmental organization that focuses on implementing initiatives in Africa and the international community to promote the relationship between migration, leadership, and development. Their mission is to assist African governments, experts, and civil society actors in addressing the migration pandemic and finding ways to benefit the development processes of their countries. They also aim to provide African development actors with tools for better migration management, including competence, training on international or regional conventions, best practices, and advice to governments.","['Migration Tools', 'Peace and Security Advocacy', 'Development Initiatives', 'Non-profit Organization', 'Migration Advocacy Organization', 'Migration and Development Services', 'African Economic Development', 'Leadership Development Services', 'Support and Guidance for Migration-related Issues', 'International Conventions Training', 'Gender Budgeting Advocacy', 'Advocacy Organization', 'Non-governmental Organization']",Non Profit,Social Services & NGOs,Human Rights Organizations,Non-Profit Management; Software Development Services; Business Development Services,0.0956; 0.0920; 0.0916,uncertain,0.0956405212290543,0.0036626617684838,,
"Raw Paste is a company that specializes in producing handmade, natural, and healthy food products such as raw natural and vegetable spreads, chocolates, and pastries. Their products are made using cutting-edge technology and are powered by their own equipment. They offer a variety of spreads including cream, butter, honey, and chocolate, as well as chocolaterie items. Raw Paste is committed to using only natural ingredients and promoting a healthy lifestyle through their products, which are sugar-free and gluten-free. They also offer a range of chocolatier-certified chocolaters and chocolatières.","['Strong Body', 'Manufacturing', 'Breath of Nature', 'All-natural Essential Oils', 'Holistic Oils Manufacturer', 'Green Energy', 'Sugar-free Options', '100% Natural Soy Wax', 'Hand-poured Soy Candles', 'Handcrafted Soy Products', 'Deep Cleaning', 'Production', 'Gift Sets', 'Recovery', 'Handmade with Love']",Manufacturing,Bakeries & Desserts,Chocolate and Confectionery Manufacturing from Cacao Beans,Confectionery Manufacturing,0.0907,uncertain,0.0907026097485998,0.0594556401257023,,
"The Mere Library is a library located in Warminster, England, United Kingdom.","['Non-profit Organization', 'Accessibility Services', 'Library Services', 'Access to Resources', 'Wheelchair Accessible Entrance']",Services,Libraries,Libraries and Archives,Non-Profit Management,0.0905,uncertain,0.0904837511694864,0.0456845217125578,,
"Tandy Books is a company that produces children's books, including the award-winning children's alphabet book ""Journey from A to Z with Teacher Judy"" by Ryan Scott Tandy. The book features 25 animals, including a ghost, and takes readers on a trip to different places around the world to learn and teach the alphabet. The author, Alex Tandy, was inspired by his aunt, Teacher Judy, who passed away from cancer in 2019. The company was founded after the author's mother requested his cousin, Ryan Scott, to help with the editing, illustration, and printing of the book.","['Educational Materials', 'Educational Books', 'Childrens Alphabet Book', 'Book Illustration Services', 'Childrens Book Publishing', 'Book Publishing', 'Journey from A to Z Book']",Retail,Book Stores,Book Retailers and News Dealers,Children's Clothing Manufacturing,0.0893,uncertain,0.0893420018730824,0.0206902918047694,,
"Kentucky River Coal Corporation (Krcc) is a land holding company that was established nearly a century ago by John C. C. Mayo and W. S. Dudley. The company purchased lands and mineral rights in Eastern Kentucky and has since expanded to cover over 95,000 acres of mineral-rich land in Western Kentucky, Illinois, and Indiana. KRCC leases its properties to coal producing companies, oil & gas companies, and timber companies on a royalty basis, offering an extensive legacy of coal reserves dating back to the early days of the nation. The first coal was mined in the Hazard area in 1916, and by 1921, production had increased to 2,632,000 tons. KRCP signed its first coal lease in August of 1946 with Blue Diamond Coal Company, which has been producing coal from the property owned by KRCC to this day.","['Private and Commercial Properties', 'Renewable Energy Illinois Basin', 'Leasing Services', 'Solar Energy Properties', 'Oil and Gas Properties Development', 'Rare Earth Elements Recovery', 'Land Holding Company', 'Residential Project', 'Mineral Land', 'Wetland Mitigation', 'Community Farming Assets']",Manufacturing,Mining & Gas Exploration,Surface Coal Mining,Land Leveling Services,0.0891,uncertain,0.0890645807151268,0.014250536081834,,
"Rack Nacional is a leading company in the manufacturing, distribution, sale, and installation of metal supports for televisions, specializing in LED, LCD, and Plasma Plasma TVs. They offer a wide range of TV racks in various sizes, including 40 to 60 inches for LED, 60 to 90 inches for plasma, 26 to 43 inches for TV racks, and 40 to 70 inches for both mobile and fixed TV racks. In addition to TV racks and pedestals, they also offer racks for monitors, projectors, and bicycles. The company guarantees strict national and international quality standards.","['Installation Services', 'Projector Racks', 'Metal Racks for Monitors and Laptops', 'Racks Manufacturer', 'Distribution Services', 'Metal Supports for TV Stands Manufacturer', 'Plate Work Fabrication', 'Metal Fabrication Services']",Manufacturing,Metal Fabrication Services,All Other Miscellaneous Fabricated Metal Product Manufacturing,Sheet Metal Services,0.0888,uncertain,0.0888043525594215,0.0458615098705575,,
"The company specializes in the production and sale of promotional films and advertising materials in Moscow, Russia. They offer a wide range of products, including printed and screen-printed films, as well as design and production services for advertising surfaces. They also provide special production and custom projects, including the production of plastic films of various sizes. The company offers a variety of films, such as those for cars, food, coffee, and clothing, among others. They are known for their affordable prices and delivery services.","['Custom-made Projects', 'Custom Project Services', 'Custom Projects for Stretcher Manufacturing', 'Stretching Services', 'Design and Production', 'Stainless Steel Spiral Staircases Manufacturer', 'Stretched Stretchers for Heavy-duty Trucks Manufacturer', 'Staircase Installation Services', 'Custom Stretched Stretches for Large-scale Projects']",Manufacturing,Plastics Products,All Other Plastics Product Manufacturing,Plastic Manufacturing; Advertising Services,0.0873; 0.0810,uncertain,0.087250316281411,0.0062281656728997,,
"Photobooks is a photography company based in the New York area, founded by Taralynn Rhodes. With over a decade of experience, Rhodes has worked with various photographic styles, including freelancing for models and musicians in Los Angeles and showcasing her street and documentary photography in galleries. Her love for realism and capturing fleeting moments is evident in her work, which has taken her to various cities worldwide to photograph people, places, and cultures.","['Photo Realism', 'Freelance Work', 'Street Photography', 'Photography Services', 'Documentary Photography']",Services,Photographers & Photographic Studios,Photofinishing Laboratories (except One-Hour),Street Cleaning Operations,0.0853,uncertain,0.0853048548619268,0.073193965537082,,
"Anhua Supply Chain Co., Ltd. is a Chinese cross-border e-commerce one-stop service platform that provides logistics, warehousing, and software services to global cross-merchandising enterprises and brand manufacturers. The company offers a full range of logistics services, including domestic and international logistics, overseas warehousing and storage, order management, and pre-sales and after-sale services. Anhua Supply chain Co.,ltd. has four major business business platforms, with over 20 domestic subsidiaries, 50 overseas branches, and more than 50 agents. The platform is committed to providing high-quality products and services, with a focus on logistics and warehousing as the foundation.","['Cross-border Logistics Services', 'International Logistics Services Provider', 'Warehousing Services']",Services,Trucking and Logistics,"General Freight Trucking, Long-Distance, Truckload",E-Commerce Services,0.0795,uncertain,0.0794894835763423,0.0153660339902786,,
